{
  "poolId": "prod-linux",
  "poolName": "Production Linux Agent Pool",
  "instanceId": "agent-vm-001",
  "instanceName": "agent-vm-001.contoso.com",
  "imageReference": "ubuntu-20.04-lts-2026-04-v1",
  "requestedBy": "autoscaler-service",
  "details": {
    "vmSize": "Standard_D2s_v3",
    "region": "eastus",
    "zone": "1",
    "vmId": "12345678-1234-1234-1234-123456789012",
    "capabilities": [
      "linux",
      "docker",
      "git"
    ]
  }
}
